{
  "schema": "agents-skill-descriptor/v1",
  "name": "visual-evidence",
  "description": "Produz validação visual regional antes/depois para imagem, PDF e Web responsiva.",
  "version": "1.0.0",
  "purpose": "Separar interpretação visual de operações mecânicas reproduzíveis.",
  "positiveTriggers": ["comparar imagem", "validar PDF visual", "corrigir interface responsiva"],
  "negativeTriggers": ["revisar texto", "analisar somente DOM", "alteração sem referência visual"],
  "roles": ["final", "constructor"],
  "authority": "evidência visual não substitui autorização nem norma",
  "inputs": {"required": ["original"], "optional": ["implemented", "matrix", "region"]},
  "output": {"format": "ledger regional e métricas"},
  "requires": ["inspeção do original"],
  "resources": [],
  "scripts": [".ia.rules/core/runtime/scripts/visual-evidence.js"],
  "hooks": [],
  "permissions": ["leitura de artefatos", "escrita de evidência autorizada"],
  "effects": ["artefatos de comparação locais"],
  "limits": {"routingDepth": 1, "ocrIsSufficient": false},
  "validation": ["dimensões", "contraste", "diff", "vínculo regional antes/depois"],
  "origin": "jcempro/agents.md",
  "license": "MPL-2.0",
  "trust": "first-party-reviewed",
  "clients": ["codex", "github-copilot"],
  "precedence": "subordinada a AGENTS.md e RCF",
  "merge": "instalação por arquivo gerenciado sem sobrescrever conteúdo não gerenciado",
  "update": "transacional por hash",
  "removal": "somente arquivo gerenciado e com aprovação"
}
